<?xml version="1.0" encoding="utf8"?>
<?xml-stylesheet type="text/xsl" href="../../xslt/fcs_html.xsl"?>
<!DOCTYPE character SYSTEM "../Mindjammer/character.dtd">
<character>
  <id>
    <charname>Margrethe Jarlov</charname>
    <playername>NPC</playername>
    <description>Played by comedienne Jen Kirkman</description>
    <homeworld name="Fathom" ref="FH 8" habituated-gravity="?" tech-index="7"/>
  </id>
  <aspects>
    <aspect type="High-Concept">Kirsten Gillibrand meets Beto O'Rourke</aspect>
    <aspect type="Trouble">Let Me Study That and Get Back to You</aspect>
    <aspect type="Motivation">Establish Myself as a Well-Connected Politician</aspect>
    <aspect type="Instinct">Don't Rock the Boat</aspect>
    <aspect></aspect>
  </aspects>
  <skills>
    <skill rating="4" name="Empathy"/>

    <skill rating="3" name="Contacts"/>
    <skill rating="3" name="Will"/>

    <skill rating="2" name="Knowledge"/>
    <skill rating="2" name="Provoke"/>
    <skill rating="2" name="Resources"/>

    <skill rating="1" name="Bureaucracy"/>
    <skill rating="1" name="Empathy"/>
    <skill rating="1" name=""/>
    <skill rating="1" name=""/>
  </skills>
  <languages>
  </languages>
  <stunts>
    <stunt name="&#160;">&#160;</stunt>
    <stunt name="&#160;">&#160;</stunt>
    <stunt name="&#160;">&#160;</stunt>
  </stunts>
  <consequences>
  </consequences>
  <hacks credit-stress="true"/>
  <phase-trio/>
  <notes>
    The most generically "moderate" candidate for Far Havens Senator.

    Inspirational to some voters, but never in a policy-specific way. Broadly inoffensive, but also
    considered a bit of a lightweight. A "compromise" candidate in all senses of the term.
  </notes>
</character>
