<?xml version="1.0" encoding="utf8"?>
<?xml-stylesheet type="text/xsl" href="../../xslt/atomic-robo_html.xsl"?>
<!DOCTYPE character SYSTEM "../AtomicRobo/character.dtd">
<character>
  <id>
    <charname>Kung Fu Trucker</charname>
    <playername>NPC</playername>
    <affiliation>Deadly Disco Комиссар</affiliation>
    <description>
    &#160;
  </description>
  </id>
  <current-fate-points>4</current-fate-points>
  <experience-points>0</experience-points>
  <aspects>
    <aspect type="Concept">Kung Fu Trucker</aspect>
    <aspect type="Mode" mode-name="Martial&#160;Artist">Fists of Fury</aspect>
    <aspect type="Mode" mode-name="Trucker">Breaker, Break Her (Him, It)</aspect>
    <aspect type="Mode" mode-name="Action">Greased Lightning</aspect>
    <aspect type="Omega"/>
  </aspects>
  <skills>
    <mode rating="3" name="Martial&#160;Artist" stress-type="physical">
      <!-- ARRPG pg88 -->
      <skill name="Athletics" cost="2"/>
      <skill name="Combat" cost="2"/>
      <skill name="Notice" cost="1"/>
      <skill name="Physique" cost="1"/>
      <skill name="Stealth" cost="2"/>
      <skill name="Will" cost="1"/>
    </mode>
    <mode rating="2" name="Trucker" stress-type="physical">
      <!-- Fighter Pilot, ARRPG pg296 -->
      <skill name="Athletics" cost="2"/>
      <skill name="Combat" cost="2"/>
      <skill name="Notice" cost="1"/>
      <skill name="Vehicles" cost="2" add="1"/>
      <skill name="Will" cost="1"/>
    </mode>
    <mode rating="1" name="Action">
      <!-- ARRPG pg82 -->
      <skill name="Athletics" cost="2"/>
      <skill name="Combat" cost="2"/>
      <skill name="Notice" cost="1"/>
      <skill name="Physique" cost="1"/>
      <skill name="Provoke" cost="1"/>
      <skill name="Vehicles" cost="2"/>
    </mode>
  </skills>
  <stunts>
    <stunt name="Blind-Fight">Your ability to attack with Combat works unimpeded by conditions like darkness or other visual impairments.</stunt>
    <stunt name="Fist of Death">By concentrating your force into a powerful blow, you may devastate even the most potent of opponents. Once per opponent per fight, you may spend a fate point after landing a successful blow to cause your opponent to check their highest unchecked physical stress box (instead of taking stress equal to the shifts you succeeded by).</stunt>
    <stunt name="Leave My Friends Alone!">+2 to attack with Fight when your opponent’s most recent action was to attack one of your allies.</stunt>
    <stunt name="Riposte">If you succeed with style on a Combat defense, you can choose to inflict a 2-shift hit rather than take a boost.</stunt>
    <stunt name="Stunning Fist: ☐ ">Once per physical conflict, when you succeed on an unarmed attack, you may place the aspect Stunned on your opponent with one free invocation.</stunt>
  </stunts>
  <consequences/>
  <experiences suppress="true"/>
  <notes/>
</character>
