<?xml version="1.0" encoding="utf8"?>
<?xml-stylesheet type="text/xsl" href="../../xslt/fcs_html.xsl"?>
<!DOCTYPE character SYSTEM "../Mindjammer/character.dtd">
<character>
  <id>
    <charname>"Speaker"</charname>
    <playername>NPC</playername>
    <description>Played by Dame Judi Dench</description>
    <homeworld name="Fathom" ref="FH 8" habituated-gravity="?" tech-index="7"/>
  </id>
  <aspects>
    <aspect type="High-Concept">Speaker for the Canopy Isolationists</aspect>
    <aspect type="Trouble">Xenophobes Ain't Xenoaware</aspect>
    <aspect type="Motivation">We Want Canopy to Deal with Outsiders for Us</aspect>
    <aspect type="Instinct">Let's Get This Conversation Over With</aspect>
    <aspect>I Assume You're Trying to Screw Us Over</aspect>
  </aspects>
  <skills>
    <skill rating="4" name="Bureaucracy"/>

    <skill rating="3" name="Provoke"/>
    <skill rating="3" name="Will"/>

    <skill rating="2" name="Deceive"/>
    <skill rating="2" name="Empathy"/>
    <skill rating="2" name="Resources"/>

    <skill rating="1" name=""/>
    <skill rating="1" name=""/>
    <skill rating="1" name=""/>
    <skill rating="1" name=""/>
  </skills>
  <languages>
  </languages>
  <stunts>
    <stunt name="Esprit de Corps">
      Gain a +2 defend bonus when personnel are acting in solidarity to resist morale attacks or propaganda campaigns.
      (Mindjammer pg 274)
    </stunt>
    <stunt name="Secret Reserves ☐ ☐">
      Nobody knows what tricks the Isolationists have up their collective sleeves.
      Twice per session, can declare an Aspect with a free Invocation to represent that. (Tianxia: Spirits, Beasts, &amp; Spells, pg 48)
    </stunt>
    <stunt name="Stubborn">
      +2 to Attack with Bureaucracy when stonewalling / creating impediments to change.
    </stunt>
  </stunts>
  <consequences>
  </consequences>
  <hacks credit-stress="true"/>
  <phase-trio/>
  <notes/>
</character>
