<?xml version="1.0" encoding="utf8"?>
<?xml-stylesheet type="text/xsl" href="../../xslt/fcs_html.xsl"?>
<!DOCTYPE character SYSTEM "../FateCore/character.dtd">
<character>
  <id>
    <charname>Jexy</charname>
    <playername>Morgan Baird</playername>
    <description>
      &#160;
    </description>
  </id>
  <aspects>
    <aspect type="High-Concept"></aspect>
    <aspect type="Trouble"></aspect>
    <aspect type="Burdens"></aspect>
    <aspect type="True-Name"></aspect>
    <aspect type="Free"></aspect>
  </aspects>
  <skills>
    <skill rating="4" name=""/>
    
    <skill rating="3" name=""/>
    <skill rating="3" name=""/>
    
    <skill rating="2" name=""/>
    <skill rating="2" name=""/>
    <skill rating="2" name=""/>
    
    <skill rating="1" name=""/>
    <skill rating="1" name=""/>
    <skill rating="1" name=""/>
    <skill rating="1" name=""/>
  </skills>
  <stunts>
    <stunt name="&#160;">
      &#160;
    </stunt>
    <stunt name="&#160;">
      &#160;
    </stunt>
    <stunt name="&#160;">
      &#160;
    </stunt>
  </stunts>
  <consequences>
    <!--
    <consequence severity="Mild">mild one</consequence>
    -->
  </consequences>
</character>
