<?xml version="1.0" encoding="utf8"?>
<?xml-stylesheet type="text/xsl" href="../../xslt/fcs_html.xsl"?>
<!DOCTYPE character SYSTEM "../FateCore/character.dtd">
<character>
  <id>
    <charname>Luna</charname>
    <playername>Eva Doucette</playername>
    <description>
      &#160;
    </description>
  </id>
  <aspects>
    <aspect type="High-Concept">Neighborhood Peacekeeper (Warden)</aspect>
    <aspect type="Trouble">Too Many Burdens</aspect>
    <aspect type="Burdens">Everyone On My Street</aspect>
    <aspect type="True-Name">Pragmatic Protector</aspect>
    <aspect type="Free"></aspect>
  </aspects>
  <skills>
    <skill rating="4" name="Warding"/>
    
    <skill rating="3" name="Alchemy"/>
    <skill rating="3" name="Illusion"/>
    
    <skill rating="2" name="Empathy"/>
    <skill rating="2" name="Provoke"/>
    <skill rating="2" name="Will"/>
    
    <skill rating="1" name="Athletics"/>
    <skill rating="1" name="Fight"/>
    <skill rating="1" name="Investigate"/>
    <skill rating="1" name="Rapport"/>
  </skills>
  <stunts>
    <stunt name="&#160;">
      &#160;
    </stunt>
    <stunt name="&#160;">
      &#160;
    </stunt>
    <stunt name="&#160;">
      &#160;
    </stunt>
  </stunts>
  <consequences>
    <!--
    <consequence severity="Mild">mild one</consequence>
    -->
  </consequences>
</character>
