<?xml version="1.0" encoding="utf8"?>
<?xml-stylesheet type="text/xsl" href="../../xslt/atomic-robo_html.xsl"?>
<!DOCTYPE character SYSTEM "../AtomicRobo/character.dtd">
<character>
  <id>
    <charname>Tiffani&#9829;</charname>
    <playername>Courtney Irving</playername>
    <affiliation>Tesladyne Oakland (Action Scientist PC)</affiliation>
    <description>&#160;</description>
  </id>
  <current-fate-points>4</current-fate-points>
  <experience-points>0</experience-points>
  <aspects>
    <aspect type="Concept">Terrifying Receptionist</aspect>
    <aspect type="Mode" mode-name="Action">Most Vicious Fighter on the West Coast</aspect>
    <aspect type="Mode" mode-name="Banter">Speaks Her Mind</aspect>
    <aspect type="Mode" mode-name="Intrigue">Sketchy Background, No Last Name</aspect>
    <aspect type="&#937;">You Wouldn't Like Me When I'm Hangry</aspect>
  </aspects>
  <skills>
    <mode rating="3" name="Action" stress-type="split"> <!-- ARRPG pg82 -->
      <skill name="Athletics" cost="2"/>
      <skill name="Combat"    cost="2"/>
      <skill name="Notice"    cost="1"/>
      <skill name="Physique"  cost="1"/>
      <skill name="Provoke"   cost="1"/>
      <skill name="Vehicles"  cost="2"/>
    </mode>
    <mode rating="2" name="Banter" stress-type="mental"> <!-- ARRPG pg83 -->
      <skill name="Contacts" cost="1"/>
      <skill name="Deceive"  cost="2"/>
      <skill name="Empathy"  cost="3"/>
      <skill name="Provoke"  cost="1"/>
      <skill name="Rapport"  cost="1"/>
      <skill name="Will"     cost="1"/>
    </mode>
    <mode rating="1" name="Intrigue" stress-type="physical"> <!-- ARRPG pg84 -->
      <skill name="Athletics" cost="2"/>
      <skill name="Burglary"  cost="1"/>
      <skill name="Contacts"  cost="1"/>
      <skill name="Deceive"   cost="2"/>
      <skill name="Notice"    cost="1"/>
      <skill name="Stealth"   cost="2"/>
    </mode>
 </skills>
  <stunts>
    <stunt name="Look Into My Eye">
      Use Provoke to defend against threats and other fear-based attacks that deal mental harm.
    </stunt>
    <stunt name=" ">&#160;</stunt>
    <stunt name=" ">&#160;</stunt>
    <stunt name=" ">&#160;</stunt>
    <stunt name=" ">&#160;</stunt>
  </stunts>
  <consequences/>
  <experiences>
    <experience/>
    <experience/>
    <experience/>
  </experiences>
  <notes>
    Still has 1 Minor Milestone (ARRPG225) from stopping the hybrid queen.
    Regardless of what modes you have, if they're all standard modes you get ONE of the following improvements:
    * Specialize one trained skill.
    * Focus one trained skill and specialize one focused skill.
    * Focus three trained skills.
  </notes>
</character>
