<?xml version="1.0" encoding="utf8"?>
<?xml-stylesheet type="text/xsl" href="../../xslt/atomic-robo_html.xsl"?>
<!DOCTYPE character SYSTEM "../AtomicRobo/character.dtd">
<character>
  <id>
    <charname>Harold G. Arrington III</charname>
    <playername>Christopher Mitchell</playername>
    <affiliation>Branch Manager of Tesladyne Oakland</affiliation>
    <description>
      A young scientist that is striving to climb the proverbial ladder of success, which he
      envisions as defined through title.  As the new office manager, Harold is determined to
      manage by the book.  There are of course many books.... It's just about using the right
      one under the right circumstance.
    </description>
  </id>
  <current-fate-points>5</current-fate-points>
  <experience-points>2</experience-points>
  <aspects>
    <aspect type="Concept">Deep Blue with a Politician's Smile</aspect>
    <aspect type="Mode" mode-name="Banter">By the Book, Not Between the Lines</aspect>
    <aspect type="Mode" mode-name="Intrigue">Secrets are the Spice of Life</aspect>
    <aspect type="Mode" mode-name="Science">Rule Maker, Code Breaker</aspect>
    <aspect type="&#937;">It's Not About Success; It's About Legacy</aspect>
  </aspects>
  <skills>
    <mode rating="3" name="Banter" stress-type="mental"> <!-- ARRPG pg83 -->
      <skill name="Contacts" cost="1"/>
      <skill name="Deceive"  cost="2"/>
      <skill name="Empathy"  cost="3" add="1"/>
      <skill name="Provoke"  cost="1"/>
      <skill name="Rapport"  cost="1" add="2"/>
      <skill name="Will"     cost="1"/>
    </mode>
    <mode rating="2" name="Intrigue" stress-type="physical"> <!-- ARRPG pg84 -->
      <skill name="Athletics" cost="2"/>
      <skill name="Burglary"  cost="1" add="1"/>
      <skill name="Contacts"  cost="1"/>
      <skill name="Deceive"   cost="2"/>
      <skill name="Notice"    cost="1" add="-1"/>
      <skill name="Stealth"   cost="2" add="2"/>
    </mode>
    <mode rating="1" name="Science" stress-type="mental"> <!-- ARRPG pg85 -->
      <skill name="Computer Science"     add="2"/>
      <skill name="Notice"               cost="1"/>
      <skill name="Will"                 cost="1"/>
      <skill name="(All Other Sciences)" cost="1"/>
    </mode>
  </skills>
  <stunts>
    <stunt name="Hiya!">
      Can Defend against physical attacks with Provoke
    </stunt>
    <stunt name="It Says Right Here in the Field Guide">
      +2 to Create an Advantage with Rapport on team members when quoting procedures
    </stunt>
    <stunt name="Pencilled-in">
      +2 to Create an Advantage with Burglary when using computers
    </stunt>
    <stunt name="Pencilled-in">
      Use Will to ignore the effects on physical stress box
    </stunt>
    <stunt name="Security System Manual">
      +2 to Create an Advantage with Computer Science when using security systems
    </stunt>
  </stunts>
  <consequences/>
  <experiences>
    <experience/>
    <experience/>
    <experience/>
  </experiences>
  <notes>
    <!--
      Minor Milestone from rescuing Dmitri: Burglary +1, Notice -1
      Minor Milestone from stopping the Hybrid Queen: Rapport +1, Empathy -1
    -->
    Still has 1 Minor Milestone (ARRPG225) from rescuing Dr. Chang from The Rock.
    Still has 1 Minor Milestone (ARRPG225) from breaking into Recombinatr.
    Still has 1 Minor Milestone (ARRPG225) from stopping Dr. Dinosaur.
      swap 2 Skills in the same Mode
      replace a Stunt
      rewrite a non-Concept Aspect
    Still has 1 Significant Milestone (ARRPG226) from stopping Dr. Dinosaur.
      1 point
      1 Experience Boost
    Still has 1 Severe Collateral Consequence (ARRPG227) from stopping Dr. Dinosaur.
      1 point
      can replace 1 Mode
      can rewrite any Aspect, including Concept
  </notes>
</character>
