<?xml version="1.0" encoding="utf8"?>
<?xml-stylesheet type="text/xsl" href="../../xslt/fate-freeport_html.xsl"?>
<!DOCTYPE character SYSTEM "../FateCore/character.dtd">
<character>
  <id>
    <charname>Gadi Melaku of the Ayhudi clan</charname>
    <playername>Kevin C. Baird</playername>
    <description>
      &nbsp;
    </description>
  </id>
  <aspects>
    <aspect type="High-Concept">Gold Dwarf Wizard from the Great Rift</aspect>
    <aspect type="Trouble">Must Prove Myself Worthy to my Prospective In-Laws</aspect>
    <aspect phase-num="1">Close to Zasheida's Family in Calimport</aspect>
    <aspect phase-num="2">M.M.S. from the Academy Arcane</aspect>
    <aspect phase-num="3">Border Patrol in the Steel Shields</aspect>
  </aspects>
  <skills shape="flat">
    <skill rating="1" name="Strength"/>
    <skill rating="2" name="Dexterity"/>
    <skill rating="2" name="Constitution"/>
    <skill rating="3" name="Intelligence"/>
    <skill rating="1" name="Wisdom"/>
    <skill rating="0" name="Charisma"/>
  </skills>
  <languages>
    Common, Draconic, Dwarvish, Elvish. Still trying to learn Halruaan.
  </languages>
  <extras>
    <gadget name="War Wizard">
      <function>
        2 Abjuration or Evocation spells. Uses Int for casting.
      </function>
      <benefits>
        <benefit cost="0" name="Arcane Shield">
          FFC pg33
        </benefit>
        <benefit cost="0" name="Magic Missile">
          FFC pg38
        </benefit>
      </benefits>
    </gadget>
    <gadget name="Manipulator">
      <function>
        3 Transmutation spells.
      </function>
      <benefits>
        <benefit cost="0" name="Alter Surface">
          FFC pg42
        </benefit>
        <benefit cost="0" name="Grace">
          FFC pg42
        </benefit>
        <benefit cost="0" name="Knock">
          FFC pg42
        </benefit>
      </benefits>
    </gadget>
    <gadget name="Seer">
      <function>
        3 divination spells.
      </function>
      <benefits>
        <benefit cost="0" name="Detect Magic">
          FFC pg35
        </benefit>
        <benefit cost="0" name="Fortune">
          FFC pg35
        </benefit>
        <benefit cost="0" name="Locate Object">
          FFC pg35
        </benefit>
      </benefits>
    </gadget>
  </extras>
  </stunts>
  <consequences/>
  <hacks corruption="true"/>
  <phase-trio>
    <phase num="1">
      <events>
        &nbsp;
      </events>
    </phase>
    <phase num="2">
      <events>
        &nbsp;
      </events>
    </phase>
    <phase num="3">
      <events>
        &nbsp;
      </events>
    </phase>
  </phase-trio>
  <notes>
    &nbsp;
  </notes>
</character>
