<?xml version="1.0" encoding="utf8"?>
<?xml-stylesheet type="text/xsl" href="../../xslt/atomic-robo_html.xsl"?>
<!DOCTYPE atomic-robo SYSTEM "../AtomicRobo/character.dtd">
<character>
  <id>
    <charname nickname="Slim">John Simmons</charname>
    <playername>&#160;</playername>
    <affiliation>Tesladyne (Science Agent PC)</affiliation>
    <description>
      Slim spent most of World War II conducting test flights of America's most advanced airframes.
      Near the close of the war Slim was selected to fly Atomic Robo's unit deep behind German lines
      as the vanguard of Operation Paperclip. Slim would later become one of the original Science
      Agents of Tesladyne. His personal expertise in the cutting edge of aeronautics technology and
      the limits of the human body would serve the firm well in its early days.
    </description>
  </id>
  <current-fate-points>0</current-fate-points>
  <experience-points>0</experience-points>
  <aspects>
    <aspect type="Concept">Former Test Pilot</aspect>
    <aspect type="Mode" mode-name="Banter">&#160;</aspect>
    <aspect type="Mode" mode-name="Science">Fictional, Theoretical... Whatâ€™s the Difference?</aspect>
    <aspect type="Mode" mode-name="Action">&#160;</aspect>
    <aspect type="Omega">&#160;</aspect>
  </aspects>
  <skills>
    <mode rating="3" name="Banter" stress-type="mental"> <!-- ARRPG pg83 -->
      <skill name="Contacts" cost="1"/>
      <skill name="Deceive"  cost="2"/>
      <skill name="Empathy"  cost="3"/>
      <skill name="Provoke"  cost="1"/>
      <skill name="Rapport"  cost="1"/>
      <skill name="Will"     cost="1" add="1"/>
    </mode>
    <mode rating="2" name="Science" stress-type="mental"> <!-- ARRPG pg85 -->
      <skill name="Aeronautical Engineering" add="2"/>
      <skill name="Notice"               cost="1"/>
      <skill name="Will"                 cost="1"/>
      <skill name="(all other Sciences)" cost="1"/>
    </mode>
    <mode rating="1" name="Action" stress-type="physical"> <!-- ARRPG pg82 -->
      <skill name="Athletics" cost="2"/>
      <skill name="Combat"    cost="2"/>
      <skill name="Notice"    cost="1"/>
      <skill name="Physique"  cost="1"/>
      <skill name="Provoke"   cost="1"/>
      <skill name="Vehicles"  cost="2" add="1"/>
    </mode>
  </skills>
  <stunts>
    <stunt name="Test Pilot">
      +1 to overcome or create an advantage with Vehicles when flying an aircraft.
    </stunt>
    <stunt name=" ">&#160;</stunt>
    <stunt name=" ">&#160;</stunt>
    <stunt name=" ">&#160;</stunt>
    <stunt name=" ">&#160;</stunt>
  </stunts>
  <consequences/>
  <experiences>
    <experience/>
    <experience/>
    <experience/>
  </experiences>
  <notes/>
</character>
